{
  "$schema": "./schema-v2.json",
  "schema_version": "2.0",
  "coverage_config": "coverage-v2.json",
  "fixture_source_tree_sha256": "5825ddb429d469d15747f98994a3662162f2c8f14f2785af8572adf8a5bd70cc",
  "quality_gates": {
    "minimum_cases": 25,
    "minimum_benign_cases": 12,
    "minimum_malicious_cases": 9,
    "minimum_raw_precision": 0.95,
    "minimum_raw_recall": 0.95,
    "minimum_root_precision": 0.95,
    "minimum_root_recall": 0.95,
    "maximum_benign_high_critical_false_positive_rate": 0.05,
    "minimum_malicious_high_critical_recall": 0.9,
    "require_complete_rule_coverage": true,
    "require_independent_variants": true
  },
  "scoring_context": {
    "source": {
      "type": "git",
      "repository_url": "https://example.invalid/TrustedAgentHub.git",
      "ref_type": "commit"
    },
    "verification": {
      "owner": true,
      "signature": false,
      "attestation": false,
      "sbom": false
    },
    "author_history": {
      "packages_published": 10,
      "avg_historical_score": 90,
      "violations_count": 0
    },
    "review_records": {
      "status": "pending",
      "reviewer_count": 0
    },
    "feedback": {
      "avg_rating": 0,
      "total_ratings": 0,
      "total_installs": 0,
      "reports_count": 0
    }
  },
  "cases": [
    {
      "id": "sr001-prompt-injection",
      "path": "corpus/malicious-code/sr001-prompt-injection",
      "ground_truth": "malicious",
      "source": {
        "origin": "synthetic",
        "reference": "benchmarks/README.md#issue-54-rule-coverage",
        "revision": "fixture-v2",
        "license": "Apache-2.0",
        "annotation": "Isolates an executable prompt override instruction without executing any command."
      },
      "content_tree_sha256": "eaa0a5d1ef481f3896878b815d6b3879901e5a8a72540e8e4d8f52efeab2d9e4",
      "expected_target": {
        "raw_rules": ["SR-001"],
        "root_issues": [{"id": "sr001-prompt-injection", "rule_ids": ["SR-001"], "effective_severity": "critical"}],
        "forbidden_effective_severities": [],
        "capabilities": [],
        "security_grade": ["D"],
        "manual_review": "required"
      },
      "enforcement": "blocking"
    },
    {
      "id": "sr001-ordinary-prompt",
      "path": "corpus/benign-code/sr001-ordinary-prompt",
      "ground_truth": "benign",
      "source": {
        "origin": "synthetic",
        "reference": "benchmarks/README.md#issue-54-rule-coverage",
        "revision": "fixture-v2",
        "license": "Apache-2.0",
        "annotation": "Ordinary user-facing prompt prose asks for confirmation and does not override policy."
      },
      "content_tree_sha256": "8daedbe71a935f1c51bc4c0589e5ec7bef799d3e6cbc9b53fb3f63ccf962290d",
      "expected_target": {
        "raw_rules": [],
        "root_issues": [],
        "forbidden_effective_severities": ["critical", "high"],
        "capabilities": [],
        "security_grade": ["B", "C"],
        "manual_review": "not_required"
      },
      "enforcement": "blocking"
    },
    {
      "id": "sr004-hardcoded-key",
      "path": "corpus/malicious-code/sr004-hardcoded-key",
      "ground_truth": "malicious",
      "source": {
        "origin": "synthetic",
        "reference": "benchmarks/README.md#issue-54-rule-coverage",
        "revision": "fixture-v2",
        "license": "Apache-2.0",
        "annotation": "Uses a clearly synthetic hardcoded API key-shaped value for static detection only."
      },
      "content_tree_sha256": "3467075c1c639c4c138a013f3b76e612b1766df77d8ce2bffe852fe5818b36a6",
      "expected_target": {
        "raw_rules": ["SR-004"],
        "root_issues": [{"id": "sr004-hardcoded-key", "rule_ids": ["SR-004"], "effective_severity": "high"}],
        "forbidden_effective_severities": [],
        "capabilities": [],
        "security_grade": ["D"],
        "manual_review": "not_required"
      },
      "enforcement": "blocking"
    },
    {
      "id": "sr004-runtime-token",
      "path": "corpus/benign-code/sr004-runtime-token",
      "ground_truth": "benign_capability",
      "source": {
        "origin": "synthetic",
        "reference": "benchmarks/README.md#issue-54-rule-coverage",
        "revision": "fixture-v2",
        "license": "Apache-2.0",
        "annotation": "Generates a process-local token at runtime rather than embedding a credential in source."
      },
      "content_tree_sha256": "f3ae647661d19d8aaff8a58cfa0afdd2039d98cf22c0567753fcfcef8da5acf7",
      "expected_target": {
        "raw_rules": [],
        "root_issues": [],
        "forbidden_effective_severities": ["critical", "high"],
        "capabilities": [],
        "security_grade": ["B", "C"],
        "manual_review": "not_required"
      },
      "enforcement": "blocking"
    },
    {
      "id": "sr006-excessive-permission",
      "path": "corpus/malicious-code/sr006-excessive-permission",
      "ground_truth": "needs_context",
      "source": {
        "origin": "synthetic",
        "reference": "benchmarks/README.md#issue-54-rule-coverage",
        "revision": "fixture-v2",
        "license": "Apache-2.0",
        "annotation": "A skill declares browser access even though the fixture has no browser capability."
      },
      "content_tree_sha256": "4f957dd549d31bbc16327ce031b217f8a0433dcf987a78b48f4089d0c9a1f83c",
      "expected_target": {
        "raw_rules": ["SR-006"],
        "root_issues": [{"id": "sr006-excessive-permission", "rule_ids": ["SR-006"], "effective_severity": "medium"}],
        "forbidden_effective_severities": [],
        "capabilities": ["browser"],
        "security_grade": ["B"],
        "manual_review": "not_required"
      },
      "enforcement": "blocking"
    },
    {
      "id": "sr006-minimal-permissions",
      "path": "corpus/benign-code/sr006-minimal-permissions",
      "ground_truth": "benign_capability",
      "source": {
        "origin": "synthetic",
        "reference": "benchmarks/README.md#issue-54-rule-coverage",
        "revision": "fixture-v2",
        "license": "Apache-2.0",
        "annotation": "The skill declares only read access to its own package files and no broad permissions."
      },
      "content_tree_sha256": "682f8de2c1369679b9df34159d89ac9be733f1f62e26fb2003c4b78d1b38a773",
      "expected_target": {
        "raw_rules": [],
        "root_issues": [],
        "forbidden_effective_severities": ["critical", "high"],
        "capabilities": [],
        "security_grade": ["B", "C"],
        "manual_review": "not_required"
      },
      "enforcement": "blocking"
    },
    {
      "id": "sr008-unlocked-dependency",
      "path": "corpus/malicious-code/sr008-unlocked-dependency",
      "ground_truth": "needs_context",
      "source": {
        "origin": "synthetic",
        "reference": "benchmarks/README.md#issue-54-rule-coverage",
        "revision": "fixture-v2",
        "license": "Apache-2.0",
        "annotation": "The dependency uses a wildcard version and is intentionally not reproducibly locked."
      },
      "content_tree_sha256": "8803f6764567dd779fb6dc6e3d3aec8409a2cc17411ebd9b077bf9f131152434",
      "expected_target": {
        "raw_rules": ["SR-008"],
        "root_issues": [
          {"id": "sr008-unlocked-version", "rule_ids": ["SR-008"], "effective_severity": "medium"},
          {"id": "sr008-wildcard-version", "rule_ids": ["SR-008"], "effective_severity": "medium"}
        ],
        "forbidden_effective_severities": [],
        "capabilities": [],
        "security_grade": ["C"],
        "manual_review": "required",
        "scan_state": "partial"
      },
      "enforcement": "blocking"
    },
    {
      "id": "sr008-locked-dependency",
      "path": "corpus/benign-code/sr008-locked-dependency",
      "ground_truth": "benign_capability",
      "source": {
        "origin": "synthetic",
        "reference": "benchmarks/README.md#issue-54-rule-coverage",
        "revision": "fixture-v2",
        "license": "Apache-2.0",
        "annotation": "The dependency uses an exact version and a neutral package name with no registry override."
      },
      "content_tree_sha256": "d467424d6f5a005ba814277d0ad543d8b9a09ed707cb2ae5535dd964eb1a7abc",
      "expected_target": {
        "raw_rules": [],
        "root_issues": [],
        "forbidden_effective_severities": ["critical", "high"],
        "capabilities": [],
        "security_grade": ["B", "C"],
        "manual_review": "not_required"
      },
      "enforcement": "blocking"
    },
    {
      "id": "sr009-missing-commit",
      "path": "corpus/malicious-code/sr009-missing-commit",
      "ground_truth": "needs_context",
      "scan_context": {"source_commit_hash": ""},
      "source": {
        "origin": "synthetic",
        "reference": "benchmarks/README.md#issue-54-rule-coverage",
        "revision": "fixture-v2",
        "license": "Apache-2.0",
        "annotation": "The scan deliberately omits acquisition commit provenance while retaining a complete content hash."
      },
      "content_tree_sha256": "07a5c72b936b9d4647c6926cacd88a64ee2174c52cc9bc09ed4f587db0976d37",
      "expected_target": {
        "raw_rules": ["SR-009"],
        "root_issues": [{"id": "sr009-missing-commit", "rule_ids": ["SR-009"], "effective_severity": "medium"}],
        "forbidden_effective_severities": [],
        "capabilities": [],
        "security_grade": ["B"],
        "manual_review": "not_required"
      },
      "enforcement": "blocking"
    },
    {
      "id": "sr009-complete-source",
      "path": "corpus/benign-code/sr009-complete-source",
      "ground_truth": "benign",
      "source": {
        "origin": "synthetic",
        "reference": "benchmarks/README.md#issue-54-rule-coverage",
        "revision": "fixture-v2",
        "license": "Apache-2.0",
        "annotation": "The same source-integrity rule receives a valid acquired commit and complete scan input."
      },
      "content_tree_sha256": "b80d6b8b3989a101da098efb4730507ad99773a365605b5bd5792dcd54cf96aa",